wine,description,country,variety
Domaine Berthoumieu 2013 Charles de Batz Tannat-Cabernet (Madiran),"Of course, this 90% Tannat wine is still very young. But it's impressive, rich and concentrated and promises to age well. It is dense with both tannins and fruit, black plum and berry flavors dominating, cut by acidity. It will be ready to drink from 2019.",France,Tannat-Cabernet
Dracaena 2013 Cabernet Franc (Paso Robles),"The addition of 15% Petite Sirah takes this bottling to a compelling place, showing barely ripe blackberries, animal fat, smoke, black pepper and a wild clove element on the nose. It's rich and layered on the palate, where chalky tannins support black cherry, grilled beef and mint flavors. This has the bones to last awhile.",US,Cabernet Franc
Duckhorn 2012 Rector Creek Vineyard Merlot (Napa Valley),"A fairly elegant expression of the variety, this wine is bright in cherry kirsch and pretty aromas of rose petal and lavender, structured to age and enjoy with food. Rector Creek Vineyard is just north of Yountville and planted in rocky alluvial soils. Drink now through 2022.",US,Merlot
Dutton-Goldfield 2014 Dutton Ranch Pinot Noir (Russian River Valley),"This wine is put together from multiple vineyard sources, including the well-known Morelli Lane and Widdoes, all farmed by the Duttons. Larger in production than many of the vineyard-designates, it offers baked bread and juicy overtones of cranberry-raspberry layered atop luxuriously toasted oak. It'll show well at the table.",US,Pinot Noir
Fritz Haag 2014 Brauneberger Feinherb Riesling (Mosel),"Fresh and fragrant of blossoms, tart yellow peach and apricot, this off-dry Riesling maintains a crystalline fruit purity that persists throughout Fritz Haag's wines. It's invigorating and irresistably quaffable. The long, melon-rind finish is lip smacking.",Germany,Riesling
Fritz Haag 2014 Riesling (Mosel),"Just a touch of honey-lemon sweetness is enough to make this zesty, citrus-focused Riesling lip smackingly delicious. Fresh, green herb and lime notes reverberate through a strong finish. Drinks well now but should meld nicely over the next five years.",Germany,Riesling
G7 2012 The 7th Generation Gran Reserva Estate Bottled Cabernet Sauvignon (Loncomilla Valley),"Dry, spicy aromas of tobacco, cedar, vanilla and berry fruits come together nicely. This Maule Valley Cab is fresh and harmonious across the palate, with nothing too pushy. Complex, balsamic flavors of olives, herbs, dried berries, turned earth and cocoa finish dry, peppery and elegant. Drink through 2019.",Chile,Cabernet Sauvignon
Le Cadeau 2014 Pinot Noir (Willamette Valley),"This wine is bursting with gorgeous cherry fruit, forward and luscious. The tannins are ripe and the acids in perfect proportion, keeping the fruit flavors buoyed upon a textural ride into a lingering finish.",US,Pinot Noir
Stoneleigh 2008 Sauvignon Blanc (Marlborough),"The Stoneleigh style traditionally favors ripeness over herbaceousness, and the 2008 holds true to form, offering up grapefruit and nectarine aromas and an appealing blend of citrus and stone-fruit flavors. It's plump and round, yet finishes fresh. Good as an apéritif or with light dishes.",New Zealand,Sauvignon Blanc
Tenuta Peter Sölva & Söhne 2007 De Silva Sauvignon (Alto Adige),"Crisp and fresh with enduring aromas of tomato leaf, citrus, pink grapefruit and white stone, this is textbook Sauvignon from the mountainous Alto Adige region of Italy. Pair it with appetizers or lightly spicy foods.",Italy,Sauvignon
TerraMater 2006 Unusual Cabernet-Shiraz-Zinfandel Red (Maipo Valley),"Haven't seen this unusual combination of grapes in quite some time, and you know what, it's much better now than when we last saw it in 2001. This vintage has a nice, almost magnetic nose, while the palate is firm and well structured, with cassis, black cherry, coffee and licorice flavors. It's a bit boring on the finish, but the mouthfeel and length are just fine. Fruity, rich and balanced. 325 cases made.",Chile,Red Blend
Isole e Olena 2005  Chianti Classico,"This Chianti Classico strikes a beautiful balance between elegance and intensity. It has both and its pretty aromas of wild berry, rose, ginger, anise and spice come forth in a continuous, steady manner. It feels bright and lively in the mouth and ends with a touch of piquant spice.",Italy,Sangiovese
Kenwood 2005 Jack London Vineyard Syrah (Sonoma Valley),"Black as a moonless night, dense in structure, tannic, bone dry and super-peppery, this Syrah isn't offering much relief right now. In all likelihood it will emerge from its cocoon in a few years to offer a wealth of ripe blackberry, currant and carob fruit.",US,Syrah
La Chablisienne 2006 Les Vénérables Vieilles Vignes  (Chablis),"The impact of 50-year old vines is seen in the concentrated fruit, ripe and full,  in this wine. The flavors are of fresh apricots, edged with green apples and pink grapefruit, a combination that shows both richness and great freshness. The finish is a reminder of the fine acidity in 2006.",France,Chardonnay
Manzoni 2006 Lucia Highland Vineyard Chardonnay (Santa Lucia Highlands),"This is a strong, oaky Chardonnay. It's crisp in acidity and forward in pineapple jam, lemon custard and vanilla meringue flavors. If you like the ripe, California style, it's for you.",US,Chardonnay
McIntyre Vineyards 2006 Mission Ranch Pinot Noir (Arroyo Seco),"Crisp, coastal acidity dominates this wine, making it mouth-wateringly tart. May be too much for some folks, but it's quite elegant, with good cherry, black raspberry and cola flavors enriched with a touch of smoky oak.",US,Pinot Noir
Abbadia Ardenga 2003 M. Vigna  (Brunello di Montalcino),"Loaded with bold, ripe fruit, exotic spice and leather, this is a simple but genuine expression of Brunello di Montalcino. The wine tastes thick and a bit chunky in the mouth because of its chewy, succulent tannins.",Italy,Sangiovese Grosso
Alamos 2007 Torrontés (Salta),"With attractive melon and other tropical aromas, this is a Torrontés that rises above the masses. It smells great and tastes like a pure blend of lychee fruit, tangerine and honeydew melon. The palate feel is smooth and round, and the finish is dry, clean and healthy. It's everything that Torrontés should be. Drink now.",Argentina,Torrontés
Anaba 2007 Chardonnay (Sonoma Coast),"This is a typical Sonoma Coast Chard in the bright acidity that firms up the ripe, long hangtime flavors. Pineapples, pears, peaches, nectarines and subtle papaya notes are joined with buttercream and cinnamon spices. Drink now.",US,Chardonnay
Apaltagua 2007 Envero Gran Reserva Carmenère (Colchagua Valley),"Composed and structured, with its fair share of richness manifested as raisin and molasses. Interestingly, the palate rings with acidity, resulting in a feel that's borderline sharp. But there's enough fruit and heft to balance things out, and the flavors of cherry, blackberry and cola are nice. A good example of elevated Carmenère (with 10% Cabernet Sauvignon) that doesn't cost an arm and a leg.",Chile,Carmenère
Harrington 2006 Wiley Vineyard Pinot Noir (Anderson Valley),"This is a very rich Pinot whose primary virtue is fruit. It just explodes with delicious cherry jam, red currant, licorice and mocha flavors. Dry and crisply acidic, it's a beautiful wine for early drinking.",US,Pinot Noir
Abbazia Santa Anastasia 2003 Montenero Red (Sicilia),"This is a luminous, mature red wine with thick concentration and huge—almost too much—emphasis on toasted oak. Aromas recall vanilla, spice and coffee, although you will find blueberry and cherry on the finish: It is a blend of Nero d'Avola, Cabernet Sauvignon and Merlot.",Italy,Red Blend
Viña Bisquertt 2007 Casa La Joya Reserve Merlot (Colchagua Valley),"Bisquertt usually does well with its value-priced Merlots, and seeing that 2007 was an excellent vintage in Chile, this wine excels in the value price range. The nose is dark and saturated, but pure and inviting. And the palate is ripe and smooth, with spice, plum, blackberry and herb notes, particularly anise. Finishes clean, smooth and peppery. Drink now.",Chile,Merlot
Emiliana 2008 Natura Chardonnay (Casablanca Valley),"Clean and honest up front, with moderate richness and modest telltale Casablanca pineapple aromas. The plate is creamier than many wines in this price range, with flavors of apple cider, citrus and some pith. Overall this is a good value wine with enough citrus and acidity to qualify it as fresh.",Chile,Chardonnay
Fattoria Alois 2007 Campole Red (Campania),"Chocolate, espresso, plum and black currant are backed by smoky nuances and natural rubber. This muscular wine offers polished tannins and firm structure to the end. A bit of wine from the 2005 and 2006 vintages is blended in.",Italy,Red Blend
Henry's Drive Vignerons 2006 The Trial of John Montford Cabernet Sauvignon (Padthaway),"From the little-known region of Padthaway, this Cabernet starts off with some very promising, perfumed aromas of mint and cassis, but then shows touches of chocolate and raisined fruit on the palate. It's soft and mouthfilling—an easy-drinking Cab to consume on the young side.",Australia,Cabernet Sauvignon
Aldegheri 2003 Le Pietre Santambrogio Red (Rosso del Veronese),"Here's an interesting blend of Corvina, Cabernet Sauvignon and Rondinella that reflects the aromas and power of each grape variety. The wine offers mature notes of cherry, clove, blackberry and cola: It tastes slightly sweet and very succulent.",Italy,Red Blend
Bertrand Ambroise 2006  St.-Romain,"A citrus-dominated wine, lime and lemon giving a crisp intensity. There is a somewhat bitter toast element, but the acidity, the fresh fruits and the soft structure act as a counter-balance. Give it six months to a year. Screwcap.",France,Chardonnay
Campomaggio 2005  Chianti Classico,"Here's a traditional Chianti Classico with pretty aromas of cherry cola, mesquite, almonds and violets. The wine is compact and elegant in the mouth and offers crisp berry flavors on the close.",Italy,Sangiovese
Carpineto 2003 Riserva  (Vino Nobile di Montepulciano),"This is a mature, jammy wine with thick layers of plum, prune and raisin. The wine's appearance is dark and concentrated and that same sensation of heaviness carries over the palate in the form of black currant and spice. The tannins are firm and tart.",Italy,Prugnolo Gentile
Cesani 2007 Pancole  (Vernaccia di San Gimignano),"Pancole is a pretty expression of Tuscany's popular Vernaccia di San Gimignano with a luminous, bright appearance and pristine aromas of stone and passion fruits. The wine is lean and tonic with spicy notes on the finish.",Italy,Vernaccia
Spier 2014 21 Gables Chenin Blanc (Western Cape),"This is a concentrated, fairly full and lush Chenin, rich in toasty oak and vanilla cream as well as notes of baked apple pie and sweet orange. The medium-weight palate is mouthfilling and satisfying, with ample acidity to lift the decadent flavors. Notes of clove, anise and toasted nuts mingle on the lingering finish. Drink now–2019.",South Africa,Chenin Blanc
Sequum 2013 Four Soil Mélange Cabernet Sauvignon (Napa Valley),"This is a soft, well-crafted wine from the eastern side of St. Helena that's both classic in its dried herb, tobacco and tea aromas and fruity with red currant and cranberry notes.",US,Cabernet Sauvignon
Sierra Starr 2014 Rising Starr Estate Bottled Cabernet Franc (Nevada County),"This is a beatifully balanced, not-too-full-bodied wine from vines grown at 2,400 feet in the Sierra range. It has classic black cherry, black olive and anise aromas, harmonious fruit flavors accented with light oak spiciness and a firm, fine-grained tannic structure.",US,Cabernet Franc
