wine,description,country,variety
Henry Fessy 2015  Juliénas,"This is a dense wine, packed with both tannins and acidity. It brings out the ageworthiness of this appellation with its rich potential and dark mineral texture. Drink this concentrated cru wine from 2018.",France,Gamay
Henry Fessy 2015  Régnié,"The wine comes from one of the cru estates followed by this negociant house. It is a light, ripe and fruity wine. With its attractive red-berry flavors, finished with crisp acidity, it is accessible and ready to drink.",France,Gamay
Heron Hill 2015 Ingle Vineyard Riesling (Finger Lakes),A wisp of bramble extends a savory tone from nose to finish on this otherwise bright bristling wine. Delicate honey tones register as off dry on the palate but balance neatly alongside flavors of freshly pressed apples and pears. The finish is marked by a touch of pencil lead. Drink now through 2020.,US,Riesling
Serpaia di Endrizzi 2010 Dono Riserva  (Morellino di Scansano),"Forest floor, menthol, espresso, cranberry and pressed violet aromas take shape in the glass. The lean linear palate shows dried sour cherry, licorice and coffee bean alongside assertive close-grained tannins. Even though the tannins are still firm, drink sooner rather than later to capture the remaining fruit.",Italy,Sangiovese
Soquel Vineyards 2013 Intreccio Library Selection Red (Napa Valley),"This blends 20% each of all five red-Bordeaux varieties, showing grapy, plummy flavor that's juicy and soft on the palate. With a core of tobacco, tar and graphite, it complements the fruity with the savory, ending simply and elegantly.",US,Bordeaux-style Red Blend
Ventosa 2015 Pinot Gris (Finger Lakes),"Fresh apple, lemon and pear flavors are accented by a hint of smoked nuts in this bold, full-bodied Pinot Gris. Rich and a bit creamy in mouthfeel yet balanced briskly, it's a satisfying white with wide pairing appeal. Drink now through 2019.",US,Pinot Gris
Lamoreaux Landing 2014 Red Oak Vineyard Riesling (Finger Lakes),"Dusty mineral, smoke and struck flint lend a savory tone to this lean light-bodied Riesling. Off dry in style, the palate offers delicately concentrated flavors of red apple and nectarine off set by tangerine acidity. Drink now through 2021.",US,Riesling
Lamoreaux Landing 2014 Yellow Dog Vineyard Riesling (Finger Lakes),Intensely smoky tones of struck flint and ash extend throughout this otherwise bright nimble Riesling. The palate boasts freshly pressed apple and pear flavors accentuated by zippy lemon-lime acidity. Drink now through 2021.,US,Riesling
Leyda 2015 Single Vineyard Falaris Hill Chardonnay (Leyda Valley),"A bright nose with green apple and citric aromas comes with mild oak. This is acidic and racy in composition, with roundness along the edges of the palate. Apple and nectarine flavors are lightly oaked and salty, while this holds form on a high-acid finish.",Chile,Chardonnay
Madonna Alta 2014 Nativo Red (Toscana),"Made with 65% Sangiovese, 20% Merlot and 15% Cabernet Sauvignon, this has subtle aromas of black-skinned fruit and thyme. The easygoing palate delivers black cherry and cinnamon alongside smooth tannins.",Italy,Red Blend
Marchesi Antinori 2015 Villa Antinori White (Toscana),"Made predominantly with Trebbiano and Malvasia, along with Pinot Bianco, Pinot Grigio and Riesling Renano, this has inviting aromas of ripe orchard fruit and citrus. The round fruity palate doles out ripe apricot, orange zest and juicy pineapple.",Italy,White Blend
Marchesi de' Frescobaldi 2014 Castiglioni Red (Toscana),"A blend of Cabernet Sauvignon, Merlot, Cabernet Franc and Sangiovese, this pleasant red has aromas of dark-skinned fruit, toast and a whiff of espresso. The light-bodied, straightforward palate offers cherry, red currant and a hint of light spice alongside zesty acidity and polished tannins.",Italy,Red Blend
Marchesi de' Frescobaldi 2015 Ammiraglia Massovivo Vermentino (Toscana),"Aromas of yellow stone fruit, white spring flower and a whiff of citrus lift out of the glass. The soft round palate offers ripe apricot, yellow peach and a hint of candied nectarine zest.",Italy,Vermentino
Martin Ranch 2014 J.D. Hurley Zinfandel (Santa Clara Valley),"Lots of spearmint, coyote mint, hot licorice, ginger snaps and Dr Pepper spice up the strawberry fruit of this wine that provides a very herbal take on the grape. Oregano, marjoram, thyme and dill all make a showing on the sip, against a backbone of sweet cherry and blackberry fruit, finishing on cedar.",US,Zinfandel
Ornellaia 2014 Le Volte Red (Toscana),"An easy-drinking blend of Merlot, Sangiovese and Cabernet Sauvignon, this opens with aromas of red berry, toast, herb and roasted coffee bean. The soft palate offers black cherry, mocha and a hint of coffee alongside bright acidity and silky tannins. Drink now.",Italy,Red Blend
Pardon et Fils 2015 Les Quartelets  (Brouilly),"Produced from cru vines at the base of Mount Brouilly, the wine has structure as well as ripe black-plum fruits. It is generous and its fruit is well balanced by acidity and solid tannins. The wines is ready to drink.",France,Gamay
Piña 2013 Wolff Vineyard Cabernet Sauvignon (Yountville),"This 100% varietal wine opens in a heady aroma of leather pouch, clove and marshmallow. Both herbaceous and tannic, it begs for more time in the bottle or substantial swirling in the glass.",US,Cabernet Sauvignon
Podere Ciona 2014 Semifonte Red (Toscana),"Made with 90% Merlot and 10% Alicante, this easygoing red opens with delicate aromas suggesting red currant and baking spice. The straightforward palate delivers red plum and clove alongside soft tannins. Enjoy soon.",Italy,Red Blend
Poggioventoso 2015 Poetico White (Toscana),"Made with Vermentino, Malvasia di Candia Aromatica and Petit Manseng, this easy-drinking white has aromas of fragrant white wild flower, citrus and white stone fruit. The ripe round palate offers apricot, lime and a hint of saline.",Italy,White Blend
Pull 2012 BDX Red (Paso Robles),"Tar, dried meat, olallieberry and sharp cedar aromas show on this blend of 51% Cabernet Sauvignon and 49% Merlot. Dried strawberries and plums mix with thyme and dried rose petals on the palate.",US,Bordeaux-style Red Blend
Pull 2013 Chardonnay (Paso Robles),"Poached pears, yellow apples and a touch of butter show on the classic nose of this Chardonnay that holds to steely frame. Very sharp acidity kicks off the sip, where Pink Lady apples and warm vanilla surround a tight minerality. It's both sharp and slightly sweet.",US,Chardonnay
R2 2013 Camp 4 Vineyard Grenache Blanc (Santa Ynez Valley),"The distinctive nose on this bottling is tight yet tropical, with mango, pineapple, pear skins, orange rinds, dried lime peels and a gin-like juniper all converging. The palate offers a balance between tightly woven texture and ripe tropicality, with lime rinds, mango and petrol touches.",US,Grenache Blanc
Rideau 2014 Estate Syrah,"Baked red cherry, crushed clove, iron and rose petals make for standard aromas on this bottling, although they are fairly light and simple here. There is a sizzle of acitity on the palate, where juicy strawberry and olallieberry flavors are easy to enjoy, made more complex by graphite and cedar touches.",US,Syrah
Tenuta Forconi 2013 Toscano Red (Toscana),"A blend of 50% Cabernet Sauvignon, 30% Merlot and 20% Sangiovese, this offers aromas of black currant, caramel and mocha. The dense palate delivers toast, leather and cedar alongside teeth-coating tannins that grip the finish.",Italy,Red Blend
Dopff & Irion 2004 Schoenenbourg Grand Cru Vendanges Tardives Riesling (Alsace),"Medium-gold in color. Complex and inviting nose layered with a strong earthy minerality, vibrant bright fruit and intriguing notes of petrol and honey. On the palate it is racy, taut and focused full of well defined ripe succulent citrus and stone fruit. Rich, viscous texture perfectly balanced by the wine's crispness and almost steely minerality. Very long, juicy, lingering finish.",France,Riesling
Ceretto 2003 Bricco Rocche Prapó  (Barolo),"Slightly backward, particularly given the vintage, the wine has a complex nose with plenty of dark fruit, Turkish delight, smoked meat and earth. A full rich palate, slightly soft, it begins to run out of steam a little in mid palate, but returns with a flourish, and the finish is long and nuanced. Will repay 5+ years of cellaring.",Italy,Nebbiolo
Matrix 2007 Stuhlmuller Vineyard Chardonnay (Alexander Valley),"The vineyard is one of the better Chardonnay sources in Alexander Valley, and in this fine vintage it lends ripe pineapple, pear, Key lime pie and Mandarin orange flavors to the wine. Lots of toasty new oak adds buttered toast and vanilla, but the wood influence is in balance. Classic Burgundian-style California Chardonnay, rich and opulent.",US,Chardonnay
Mauritson 2007 Rockpile Cemetary Vineyard Zinfandel (Rockpile),"Defines Rockpile Zinfandel in intensity of fruit and high alcohol which is in keeping with the volume. There are few red wines in the world like this. It's fully dry, with potent flavors of baked blackberries, blackcurrants, cola and peppery spices, and the tannins are huge, but negotiable. Demands the richest grilled meats and cheeses.",US,Zinfandel
Henry's Drive Vignerons 2006 Parson's Flat Shiraz-Cabernet Sauvignon (Padthaway),"The blend is roughly two-thirds Shiraz and one-third Cabernet, and the result combines berries with cassis and generosity with structure, all framed by toasty oak. Savory in character, long and dusty on the finish. Drink now-2018.",Australia,Shiraz-Cabernet Sauvignon
Silverado 2006 Cabernet Sauvignon (Napa Valley),"This sophisticated wine is mostly Cabernet Sauvignon, which accounts for the firm tannins and dense structure as well as most of the blackberries and blackcurrants. Smaller amounts of Merlot and Cabernet Franc add cherries and violets, while oak contributes smoky complexities. Rich and elegant, the wine provides lovely drinking now.",US,Cabernet Sauvignon
Le Riche 2003 Cabernet Sauvignon Reserve Cabernet Sauvignon (Stellenbosch),"Etienne Le Riche is a total Cabernet specialist. With a tiny production of 5,000 cases across all his wines, this is boutique in the best sense. The Reserve Cabernets are, of course, the stars. This 2003 is fruit and wood driven, a powerful but still elegant wine, with black plums, tannins and super-ripe fruits.",South Africa,Cabernet Sauvignon
Pierre Sparr 2007 Vendages Tardives Gewurztraminer (Alsace),"Mid-gold color. Pronounced and enticing aromas of ripe citrus and stone fruit, layered with honey and floral notes with a touch of sweet spice. Rich and creamy texture packed with sweet ripe juicy fruit, honey, spice and a twist of sage. Off-dry, deliciously smooth with fresh acidity and medium-body. An elegant wine with a long, creamy, spicy finish.",France,Gewürztraminer
Pierre Sparr 2008 Alsace One White (Alsace),"Attractive mid-gold color with intense aromas of ripe citrus and stone fruit, strong minerality and hints of spice. Racy with crisp acidity, juicy, rich and smooth texture with lots of concentrated, bright flavors of blood orange, peach, apricot, mango and spice. Strong minerality follows through to a long, precise, juicy finish.",France,White Blend
Kuentz-Bas 2008 Pinot Blanc (Alsace),"Compelling minerality on the nose, Refined and focused floral aromas with ample ripe stone fruit and a hint of petrol. Racy acidity and lovely taut palate with generous layers of juicy ripe peach, apricot and nectarine.  Strong minerality prevails across the palate leading to a lingering finish. Very balanced.",France,Pinot Blanc
Camberley 2004 Philosophers' Stone Red (Stellenbosch),"A big, black bruiser of a wine that has black olive flavors and aromas and plenty beyond. Raspberry, mulberry, vanilla and spice all vie on the nose, while the palate is so dark it´s tough to discern the plum and leather flavors. Give it three years and reap the benefits.",South Africa,Bordeaux-style Red Blend
Ceretto 2003 Bricco Rocche Brunate  (Barolo),"At the first it was quite muted and subdued, but over a ten minute period it developed beautifully in the glass. The dark fruit is still dominant, but it is beginning to show some interesting tertiary aromas of earth, mushrooms and leather. Well balanced with a medium finish. Needs a few more years, but can be enjoyed now with a good deal of pleasure.",Italy,Nebbiolo
Dopff & Irion 2008 Gentil White (Alsace),"Attractive mid-gold color. Compelling layers of tangy citrus and stone fruit aromas with notes of honey and earthy minerality. Intense flavors of honey, tangy orange citrus, sweet peach and apricot that are both rich and juicy.  Crisp acidity provides a perfect balance for the slight sweetness on the finish. Taut and focused.",France,Alsace white blend
Delheim 2001 Grand Reserve Cabernet Sauvignon (Simonsberg-Stellenbosch),"A Cabernet-dominated (98%) wine, which boasts a dense, concentrated tannic structure. Flavors of cassis underly this, while the wood spices contribute their ribbon of flavor. This is an impressive wine, the flagship red from this estate founded by Spatz Sperling over 30 years ago.",South Africa,Cabernet Sauvignon
Poderi Luigi Einaudi 2003  Barolo,"Einaudi's wines have been improving lately, and this Barolo was very impressive, given the trying conditions of the vintage. Big rich, fat with smoked meat and a good dose of oak, the wine was one of the few that didn't peter out early but stayed on the palate to the end, culminating in an nice easy finish.",Italy,Nebbiolo
Clark-Clauden 2007 Cabernet Sauvignon (Napa Valley),"Give this young Cab time in the cellar to come around. Right now, it's fresh and tannic, with primary fruit blackberry and cherry flavors, and the sweet smoky oak hasn't been integrated. Should knit together over the next 4-6 years, at least.",US,Cabernet Sauvignon
Giacomo Ascheri 2001 Sorano  (Barolo),"The color is just beginning to show signs of browning at the edge, but the wine is still fresh and vibrant. The nose is complex, showing licorice, summer fruits, caramel and roses. On the palate, it is soft and pleasant, but lacks some concentration.  At its peak, but will drink well for a few years.",Italy,Nebbiolo
Lassègue 2003  Saint-Émilion,"This wine's black cherry and plum flavors veer dangerously toward prune—no doubt a product of the exceedingly hot summer. It's creamy and supple in texture, adding just enough tobacco, vanilla and smoke for complexity. But for all the fruit and ripeness, it finishes with great elegance and precision. Drink now–2020. Imported by Acadia Imports.",France,Bordeaux-style Red Blend
Beaumont 2005 Hope Marguerite Chenin Blanc (Walker Bay),"This is great Chenin Blanc, wood fermented but still leaving all the varietal character. Rich, creamy, almond flavors and silky smooth, which keeps all the essential acidity of the grape, with added spice and vanilla.",South Africa,Chenin Blanc
Dopff & Irion 2008 Crustacés White (Alsace),"Mid-gold color. Very mineral driven with subtle aromas of bruised apple and stone fruit compote. Crisp, fairly taut palate showing strong minerality and ripe flavors of red apple, cantaloupe, sweet nectarine and spice. Taut and precise texture with a long, slightly austere finish.",France,Alsace white blend
Kuentz-Bas 2007 Cuvée Jerémy Sélection de Grains Nobles Pinot Gris (Alsace),"Beautiful deep gold color. Intense, concentrated nose with vibrant aromas of honey, citrus marmalade and savory botrytis notes. Deliciously sweet and succulent, yet balanced by good acidity.  Packed with flavors of sweet ultra-ripe stone and tropical fruit, with honey and botrytis notes following through. Strong minerality prevails to a long, complex finish.",France,Pinot Gris
Poderi Colla 2005 Costa Bruna  (Barbera d'Alba),"A big, fat, luscious wine with plenty of toasty oak, dark jammy fruit and spices. The palate showed the same lushness; with the fruit front and center with surprising length.  A delicious, rather hefty effort short on finesse but long on flavor.",Italy,Barbera
Giacomo Ascheri 2003 Vigna dei Pola  (Barolo),"This is one of the more complex wines from the 2003 vintage. The nose has aromas of blackberry liquer, smoked meat, truffle and road tar. On the palate the fruit seems a little heavier and more roasted, but still melds well with its earthy, mushroomy flavors. Medium finish.",Italy,Nebbiolo
Banyan 2007 Riesling (Santa Lucia Highlands),"A beautiful wine, sleek, crisp and ultra-dry, with the most refined flavors of petrol, white peach, kaffir lime, apricot skin and minerals. The acidity is very high and palate-cleansing. The wine was half fermented in barrels, half in stainless steel. Sommeliers, buy this by the case, if you can find it.",US,Riesling
Domaine Zind-Humbrecht 2007 Hunawihr Clos Windsbuhl Pinot Gris (Alsace),"Rich gold in color. Broad, layered aromas of very ripe fruit with hints of sweet smoke, brown sugar, honey and a savory earthy minerality. Full-bodied, bone dry, but richly textured with crisp acidity and a wide palette of flavors, ripe stone fruit, a creamy savory earthiness, sage and a balsamic kick on the finish. Very long length, slightly warm but with a lingering savory, mineral finish.",France,Pinot Gris
Terra Valentine 2013 K Block Cabernet Sauvignon (Spring Mountain District),"Thick and brooding, this dark, sweetly tannic wine also offers higher-toned elements of cedar, dried herb and graphite. It finds its balance amid a full-bodied density of fruit concentration and girth of structure. Drink now through 2023.",US,Cabernet Sauvignon
Testarossa 2013 Guidotti Vineyard Pinot Noir (Santa Lucia Highlands),"Cooked cranberry is spiced with anise, peppercorn and roasted beef slices on this bottling from a vineyard planted by three brothers who are longtime Salinas Valley farmers. The palate shows dark cranberry and raspberry, spiced up by chopped sage, thyme and bay leaf.",US,Pinot Noir
Vincent Vineyards 2010 Family Reserve Cabernet Sauvignon (Santa Ynez Valley),"There's a touch of hot asphalt, pencil lead and miso on the nose of this first vintage from a promising, well-funded project, with dark elderberry fruit and dried dill rounding out the aromas. The palate blends a gamy beef quality with oregano, marjoram, cooked strawberry, baked blackberry and a sesame-oil character.",US,Cabernet Sauvignon
Vincent Vineyards 2012 Family Reserve Cabernet Sauvignon (Santa Ynez Valley),"Black cherry, black plum and black currant are integrated well into the fresh dill and smoke scents on the nose of this wine from one of the region's newest properties. It discloses a rich dark-chocolate sauce character on the palate as well as black-currant-jelly flavors, but most impressive is the lush, sexy and soft mouthfeel.",US,Cabernet Sauvignon
Weingut Liebfrauenstift 2014 Dry Riesling (Rheinhessen),"Crisp, pristine peach and apricot notes resonate through the nose and palate of this fresh, blossomy dry Riesling. While zesty and lithe in body, ripe grapefruit and melon flavors feel supple and silky on the palate. Drink now through 2019.",Germany,Riesling
Wrath 2013 Destruction Level Red (Monterey),"Smashed blackberry and blueberry fruit are enhanced by burned caramel, heavy slate and touches of soy and smoke on the nose. There's great depth in both body and flavors once sipped, with a layer of fine-grained tannins revealing teriyaki, black plum, boysenberry and touches of lavender.",US,Rhône-style Red Blend
Yardstick 2013 Ruth's Reach Cabernet Sauvignon (Napa Valley),"This wine shows off Yountville fruit at its finest, starting with a floral component to the nose. Spicy, bright and lifted, it coats the palate in ripe berry and cherry, ending with a snap of vanilla.",US,Cabernet Sauvignon
Herdade Grande 2014 Gerações Colheita Seleccionada Branco White (Alentejano),"This bottling shows a rich, wood-aged wine, full of ripe yellow and tropical fruits as well as rich toasty flavors. The wine is warm, rounded, spicy and with its impressive structure still developing, it has the potential to age well. The wine is named to celebrate the second Lança generation in charge at the estate. Drink from 2017.",Portugal,Portuguese White
Albatross Ridge 2012 Estate Reserve Pinot Noir (Carmel Valley),"From a promising new project, the nose of this wine is linear and focused, with black raspberry, black licorice, cola, wet sagebrush and rain-on-slate scents. The tactile acidity once sipped creates a fascinating soft buzz on the tongue, with flavors of dried mint, brisk raspberry and cherry tomato. Camphor and eucalyptus add intrigue on the finish.",US,Pinot Noir
Alta Colina 2012 Old 900 Syrah (Paso Robles),"Dark and thick in the glass, this wine shows strong but not bitter tar notes on the nose plus charred beef in a blueberry glaze, wet campfire, bourbon barrel and vanilla. The structure is massive now, gooey with thick tannins and flavors of espresso bean and condensed purple flowers. Judicious acidity ensures strong cellaring potential. Drink 2018–2027.",US,Syrah
Marques de Griñon 2010 Single Vineyard Estate Bottled Graciano (Dominio de Valdepusa),"Ripe aromas of raisin, black plum and horsehide are pointy and peppery. On the palate, this Graciano is bold and energetic, with lifting acidity. Loud berry flavors come with strong accents of dark chocolate and bitter espresso, while the finish is long but just moderate in complexity. Drink through 2020.",Spain,Graciano
Big Basin 2013 Syrah (Santa Cruz Mountains),"Bradley Brown's appellation blend is a nice entry point to this exciting winery. This wine shows lavish smoked black currant and plum flavors, with aromatically lifting spices of anise and black pepper and a savory roast-beef element. The palate packs lots of pepper and relies on plump black cherry, boysenberry and a dark-chocolate syrup richness.",US,Syrah
Carl Graff 2014 Graacher Himmelreich Spätlese Riesling (Mosel),"Approachably fruity yet nuanced and electrifying, there's exceptional value here. High-intensity flavors of tangerine and stone fruit sweeten the palate, balanced by nerve-tingling acidity and deep ripples of slate, salt and honeycomb. It's an intensely zesty wine, but the finish has length and power.",Germany,Riesling
Casa Santa Vitória 2013 Grande Reserva Tinto Red (Alentejano),"From an estate in the south of the Alentejo, this is a rich, hot-country wine. It is firm, densely structured and with solid, dark tannins. There is a juicy black fruit background to this dense wine that gives a lift. Still young, this dark and very concentrated wine will be better from 2018.",Portugal,Portuguese Red
Castello di Gabbiano 2012 Bellezza Gran Selezione  (Chianti Classico),"Baked plum, Asian spice, vanilla and menthol aromas carry the nose. The elegantly structured palate offers fleshy black cherry, licorice, mint and well-integrated French oak alongside fine-grained tannins that lend firm, polished support. A coffee note marks the finish.",Italy,Sangiovese
Castello Romitorio 2011 Filo di Seta  (Brunello di Montalcino),"Intense aromas of ripe red berry, menthol, espresso and star anise lead the nose. The concentrated palate offers cranberry, dried Morello cherry, sage and licorice alongside close-grained tannins that grip the finish. Drink from 2018 through 2025.",Italy,Sangiovese
Château Vincens 2012 Malbec (Cahors),"Low-yield vines on the best parcels of the Vincens estate are the source of this wine. It is super-rich and concentrated, maybe too much in its opulent excess. The wine does have great plum and berry flavors that are generous and full in the mouth. The wine even now is still young and will be better from 2018.",France,Malbec
Chronic Cellars 2013 Mr. Nibbles Red (Paso Robles),"A hearty blend of 76% Zinfandel and 24% Petite Sirah, this bottling packs a wallop of cinnamon-stick on the nose as well as strawberry puree, licorice and black pepper. Clove, allspice, and nutmeg arise immediately on the sip, backed by baked plum and bay leaf notes.",US,Red Blend
Claiborne & Churchill 2014 Claiborne Vineyard Riesling (Edna Valley),"More complex than the winery's appellation blend, yet also requiring time to reach full potential, this shows delicate lemon slices, honeysuckle, surf wax, pink grapefruit and a touch of coconut on the nose. The palate is grippy in texture and sizzling with mouthwatering acidity, offering lemon rind, grapefruit spritz and petrol flavors. Expect inviting nut and honey-dust flavors to emerge. Drink 2018–2034.",US,Riesling
Collin-Bourisset 2011 Hospices Civils de Romanèche Thurins  (Moulin-à-Vent),"Produced from vineyards donated to a charitable hospital in the 19th century, this wine is rich and now perfectly mature. It has smoky tannins that lie under the fine, elegant cherry and red plum fruits and acidity. The wine still has freshness although the attraction here is the ripe structure. The ornate label dates back to 1926.",France,Gamay
Conde de Velázquez 2012 Condesa Real Premium Blend Red (Aconcagua Valley),"This blend of Cabernet Sauvignon, Syrah and Merlot opens with blackened aromas of charred oak and creosote, but it quickly sheds that oak-heavy character to display toasty flavors of olives, herbs and berry fruits. All together, this is a classic Chilean red blend, with fine tannins and patented lightly herbal, balsamic flavors. Drink through 2020.",Chile,Red Blend
Cono Sur 2012 20 Barrels Cabernet Sauvignon (Maipo Valley),"Dry, briary aromas of field brush, black olive, herbs, berry fruits and saucy tomato are textbook Maipo. This is fresh, a touch choppy, and not overly heavy. Flavors of cassis, plum and vanilla carry over to the finish, which is fresh and bolstered by fine natural acidity. Drink through 2022.",Chile,Cabernet Sauvignon
